Name_of_Covered_Entity	State	Individuals_Affected	Date_of_Breach	Type_of_Breach	Location_of_Breached_Information	Summary
PBH	NC	50000	11/15/2011	Unauthorized Access/Disclosure, Other	Network Server, E-mail
CardioNet, Inc	PA	1300	11/10/11	Theft	Laptop
MDwise, Inc.	IN	2700	2/10/11	Unauthorized Access/Disclosure	Other
Ford Motor Company	MI	1700	1/3/12	Other	Paper
Foundation Medical Partners	NH	771	11/19/2011 - 12/01/2011	Theft	Paper	Without permission from the covered entity (CE), an employee provided a list of patient's names to a local counseling center as the employee was leaving the CE to begin employment at the new counseling center in an attempt to coordinate care of the patients she was treating.  The list, containing the PHI of approximately 771 individuals, included names, dates of birth, addresses, phone numbers, names of the insurance carriers, and facility codes.  Following the disclosure, the CE provided breach notification to HHS, the media, and all individuals affected and sanctioned the former employee for violating its policies and procedures. The CE also changed its procedures for list management.  The CE sent a reminder to all of its health care providers regarding the handling of PHI and made plans to provide HIPAA compliance information in a quality assurance newsletter.
Kansas Department on Aging	KS	7757	1/11/12	Theft	Laptop
Delta Dental of California	CA	11646	12/22/2011 - 12/23/2011	Other	Paper
Muskogee Regional Medical Center	OK	844	12/5/11	Loss	Other
Department of Medical Assistance Services	VA	1444	11/02/2011 - 11/16/2011	Unauthorized Access/Disclosure, Other	Paper
Oldendorf Medical Services, PLLC	NY	549	1/17/2012	Theft	Laptop	OCR opened an investigation of the covered entity (CE) after it reported two unencrypted laptops were stolen that contained the electronic protected health information (ePHI) of 549 individuals.  The ePHI included names, dates of birth, diagnostic test results, and social security numbers.  Upon discovery of the breach, the CE filed a police report to recover the stolen items.  As a result of OCR's investigation, the CE installed security cameras and new door locks and changed the codes to the outside entrance keypad lock.  The CE also encrypted laptop computers. 
St.Vincent Physician Network	IN	1423	12/01/2010-11/21/2011	Theft, Unauthorized Access/Disclosure	Paper
Flex Physical Therapy	WA	3100	12/30/2011	Theft	Desktop Computer
Metro Community Provider Network	CO	3200	12/5/11	Hacking/IT Incident, Other	E-mail
University of Miami 	FL	1219	11/24/2011	Theft	Other Portable Electronic Device
UnitedHealth Group health plan single affiliated covered entity	MN	6678	12/15/2011	Other	Paper
Triumph, LLC	NC	2000	12/13/2011	Theft	Laptop
Fairview Health Services	MN	14000	7/25/2011	Theft	Laptop
Loma Linda University Medical Center (LLUMC)	CA	1366	12/19/2011	Other	Paper
Ford Motor Company Salaried Health Reimbursement Arrangement (HRA) Plan	MI	1700	12/29/2011	Other	Other
Medco Health Solutions, Inc.	NJ	1287	11/30/2011	Theft	Paper	 
Lakeview Medical Center	WI	698	1/4/12	Theft	Laptop
Goshen Health System, Inc.	IN	660	12/22/2011	Hacking/IT Incident	Other
Georgetown University Hospital	DC	1549	11/1/11	Unauthorized Access/Disclosure	Paper
Motion Picture Industry Health Plans (MPI)	CA	703	09/23/2009 - 12/02/2011	Other	Other
Ochsner Health System	LA	2088	1/19/2012	Loss	Other Portable Electronic Device
Applegate Valley Family Medicine	OR	2300	12/01/2011-12/17/2011	Theft, Unauthorized Access/Disclosure	Laptop
CardioNet, Inc.	PA	728	12/29/2011	Theft	Laptop
Presbyterian Healthcare Services	NM	7000	12/29/2011	Theft	Laptop
Alliant Health Plans, Inc.	GA	632	1/1/12	Unauthorized Access/Disclosure	Other
FIRST MEDICAL CENTER, INC.	PR	7706	1/11/12	Theft	Laptop	An unencrypted laptop computer and external hard drive containing the electronic protected health information (ePHI) of 7,706 individuals were stolen from a staff member of the covered entity's (CE) business associate (BA).  The ePHI included names, ages, sex, social security numbers, medical services provided, diagnosis codes, and dates of service.  Upon discovery of the breach, the CE filed a police report to recover the stolen items and provided breach notification to HHS, the media, and all individuals affected by the breach.  As a result of OCR's investigation, the CE had its BA conduct a risk analysis, implement new security policies and procedures to ensure adequate safeguards to protect ePHI, and retrain its employees.  In addition, the CE also had its BA change its security practices to include encryption on all laptops and restrict the use of portable media devices.  OCR obtained assurances that the CE implemented the corrective action listed above and required two additional corrective actions.  OCR identified the need for the CE to complete a risk assessment and implement certain security policies and procedures.
Lee Miller Rehabilitation Associates	MD	10480	1/15/2012	Theft	Network Server
Jeremaih J. Twomey, F.A.C.P., P.A.	TX	2559	12/31/2011	Theft	Other
Anchorage Community Mental Health Services Inc.	AK	2743	12/20/2011 - 01/04/2012	Unauthorized Access/Disclosure	Desktop Computer
Robley Rex VA Medical Center 	KY	1182	1/9/12	Other	Paper
Indiana Internal Medicine Consultants	IN	20000	2/11/12	Theft	Laptop	A laptop computer that contained the electronic protected health information (ePHI) of approximately 20,000 individuals was stolen from the covered entity's (CE) laboratory manager's office.  The ePHI involved in the breach included patients' names, dates of birth, clinic identification numbers, and laboratory results.  Following the breach, the CE reported the theft to the building management company.  The management company investigated the theft and determined that cleaning personnel had stolen the laptop.  The company reported that the patient information was not compromised, as the database could not be accessed without propriety software and specialized assistance. As a result of OCR's investigation, physical security was improved by housing the replacement laptop in a locked drawer in a locked office with limited staff access.  The CE also implemented a new policy prohibiting the storage of PHI on the laptop computer and updated additional policies and procedures to enhance safeguards for systems containing PHI.      
Policlinica La Familia IPA 343	PR	5994	1/11/12	Theft	Laptop	An unencrypted laptop computer and external hard drive containing the electronic protected health information (ePHI) of 5,994 individuals were stolen from a staff member of the covered entity's (CE) business associate (BA).  The ePHI included names, ages, sex, social security numbers, medical services provided, diagnosis codes, and dates of service.  Upon discovery of the breach, the CE filed a police report and provided breach notification to HHS, the media and all affected individuals.  As a result of OCR's investigation, the CE had its BA conduct a risk analysis, implement new security policies and procedures to ensure adequate safeguards to protect ePHI, and retrain its employees.  In addition, the CE also had its BA change its security practices to include encryption on all laptops and restrict the use of portable media devices. OCR obtained assurance that the CE implemented the corrective action listed above and required one additional corrective action.  OCR identified the need for the CE to implement certain security policies, procedures and controls.
Servicios Medicos Integrados de Fajardo	PR	10000	1/11/12	Theft	Laptop, Other Portable Electronic Device	The covered entity (CE) filed a breach report with OCR after an external hard drive and laptop computer containing electronic protected health information (ePHI) of 39,609 individuals were stolen from the CE's Business Associate (BA).  The ePHI included names, ages, sex, social security numbers, medical services provided, diagnosis codes, and the dates of the service.  Immediately following the breach, the CE conducted a risk assessment, filed a breach report and provided OCR a copy of its BA agreement.  Additionally, the CE notified all affected individuals of the breach and issued a press release.  As a result of OCR's investigation, the CE required the BA to revise its security practices to include laptop encryption and restrictions on the use of portable media devices as outlined in the BA's newly developed security policies and procedures.  
Proveedores Aliados por tu SAlud	PR	4645	1/12/12	Theft	Laptop	OCR opened an investigation of the covered entity (CE), First Proveedores Aliados Por Tu Salud, after it reported an unencrypted laptop computer and external hard drive containing the electronic protected health information (ePHI) of 4,645 individuals were stolen from a staff member of the CE's business associate (BA), Quantum Health.  The ePHI included names, age, sex, social security numbers, medical services provided, diagnosis codes, and the dates of service.  Upon discovery of the breach, the CE filed a police report and provided breach notification to all individuals affected by the breach, HHS, and the media.  As a result of OCR's investigation, the CE had its BA conduct a risk analysis and implemented new security policies and procedures to ensure adequate safeguards to protect ePHI and retrain its employees.  In addition, the CE also had its BA change its security practices to include encryption on all laptops and restricted the use of portable media devices.    
Centro de Servicios de Cuidados Dirigidos, Inc. d/b/a Metro Salud grupo Profesional	PR	27098	1/11/12	Theft	Laptop	OCR opened an investigation of the covered entity (CE), Centro De Servicios de Cuidados Dirigidos, Inc. d/b/a Metro Salud grupo Profesional, after it reported an unencrypted laptop computer and external hard drive containing the electronic protected health information (ePHI) of 27,098 individuals were stolen from a staff member of the CE's business associate (BA), Quantum Health.  The ePHI included names, age, sex, social security numbers, medical services provided, diagnosis codes, and the dates of service.  Upon discovery of the breach, the BA filed a police report and provided breach notification to the media, and all affected individuals.  The CE provided breach notice to HHS.  As a result of OCR's investigation, the CE had its BA conduct a risk analysis and implemented new security policies and procedures to ensure adequate safeguards to protect ePHI and retrain its employees.  In addition, the CE also had its BA change its security practices to include encryption on all laptops and restricted the use of portable media devices.  The CE also terminated its BA agreement with the BA.  The breach incident involved a BA and occurred prior to the September 23, 2013, compliance date.  OCR verified that the CE had a proper BA agreement in place that restricted the BA's use and disclosure of PHI and required the BA to safeguard all PHI.
Kern Medical Center 	CA	1431	2/25/2012	Theft	Paper
William F. DeLuca Jr., M.D.	NY	577	1/16/2012	Theft	Laptop	OCR opened an investigation of the covered entity (CE) after it reported two unencrypted laptops were stolen that contained the electronic protected health information (ePHI) of 577 individuals.  The ePHI included names and pictures.  Upon discovery of the breach, the CE filed a police report to recover the stolen items.  As a result of OCR's investigation, the CE encrypted its computers, changed the locks to a numbered key system, and installed a lock to secure portable devices in storage.  In addition, the CE started using identification numbers instead of names on patients' files.  The CE also revised its security policy and trained all staff on its policies.
Grupo Medico IPA -341	PR	7923	1/11/12	Theft	Laptop	An unencrypted laptop computer and an external hard drive containing the electronic protected health information (ePHI) of 7,923 individuals were stolen from a staff member of the CE's business associate (BA).  The ePHI included names, ages, gender, social security numbers, medical services provided, diagnosis codes, and dates of service.  Upon discovery of the breach, the CE filed a police report to recover the stolen items.  The CE also provided breach notification to all affected individuals, HHS, and the media. As a result of OCR's investigation, the CE had its BA conduct a risk analysis, implement new security policies and procedures to ensure adequate safeguards to protect ePHI, and retrain its employees. The CE also had its BA change its security practices to include encryption on all laptops and restrict the use of portable media devices.  
Advanced Clinical Research Institute	CA	875	1/26/2012	Theft	Paper
Access Medical Group -IPA 344	PR	7606	1/11/12	Theft	Laptop, Other Portable Electronic Device	An unencrypted laptop computer and external hard drive containing the electronic protected health information (ePHI) of 39,609 individuals were stolen from a staff member of the covered entity's (CE) business associate (BA).  The ePHI included names, ages, sex, social security numbers, medical services provided, diagnosis codes, and dates of service.  Upon discovery of the breach, the CE filed a police report and provided breach notification to HHS, the media and all affected individuals.  As a result of OCR's investigation, the CE had its BA conduct a risk analysis, implement new security policies and procedures to ensure adequate safeguards to protect ePHI, and retrain its employees.  In addition, the CE also had its BA change its security practices to include encryption on all laptops and restrict the use of portable media devices. OCR obtained assurance that the CE implemented the corrective action listed above and required one additional corrective action.  OCR identified the need for the CE to implement certain security policies, procedures and controls.
Georgia Health Sciences University	GA	513	1/18/2012	Theft	Laptop
Baylor Heart and Vascular Center, LLP	TX	1972	1/26/2012	Theft	Other Portable Electronic Device
Chicago Musculoskeletal Institute/Metro Orthopedics	IL	750	12/31/2011	Other	Network Server
Tufts Associated Health Maintenance Organization, Inc. and Tufts Insurance Company	MA	3482	01/17/2012-02/02/2012	Other	Paper
Duke University Health System	NC	1370	07/01/2008 - 11/30/2011	Unauthorized Access/Disclosure	Other
St. Joseph's Medical Center	CA	712	2/2/12	Theft	Paper
UnitedHealth Group health plan single affiliated covered entity	MN	3537	6/28/2011	Unauthorized Access/Disclosure	Other
CenterLight Healthcare	NY	642	1/27/2012	Unauthorized Access/Disclosure	E-mail
Lake Granbury Medical Center	TX	502	2/13/2012	Theft	Paper
County of Wayne Department of Personnel/Human Resources Benefits Administration Division	MI	1229	3/16/2012	Unauthorized Access/Disclosure	E-mail
St. Elizabeth's Medical Center	MA	6831	2/1/12	Loss	Paper
The Neighborhood Christian Clinic	AZ	9565	2/7/12	Loss	Other Portable Electronic Device
AccentCare Home Health of California, Inc. Medicare # 057564    CA state License # 080000226	CA	1000	04/20/2012 - 04/21/2012	Unauthorized Access/Disclosure	E-mail
Seton Health Plan	TX	555	3/9/12	Unauthorized Access/Disclosure	Paper
awklein a med corp	CA	2000	2/1/11	Theft	Other
Utah Department of Health	UT	780000	03/10/2012-04/02/2012	Hacking/IT Incident	Network Server
IU Medical Group	IN	1000	4/11/12	Improper Disposal	Paper
Rhinebeck Health Center/Center for Progressive Medicine	NY	6745	11/15/2011-12/14/2011	Theft	Desktop Computer, Network Server	The CE's network server and two local computers were hacked and compromised by a computer virus which resulted in the disclosure of electronic protected health information (ePHI) of 6,745 individuals.  The ePHI included names, insurance numbers, diagnoses, medical histories, dates of birth, telephone numbers, and social security numbers.  Upon discovery of the breach, the CE shut down all computer and email systems to prevent unauthorized access to its network and core files.  In addition, the CE decommissioned the previously used server, deactivated the network router, disabled network access to ePHI, and discontinued the previously utilized backup.  As a result of OCR's investigation, the CE deployed a new real-time firewall and intrusion detection system and implemented new measures for software management.  In addition, the CE installed a new network server, deployed a new router with security subscription to actively monitor internal network traffic and external threat patterns, and implemented a centralized antivirus software system.
Memorial Healthcare System	FL	9497	08/01/2011 - 02/12/2012	Other	Other
Roy E. Gondo, M.D.	WA	2100	2/21/2012	Theft	Desktop Computer, Electronic Medical Record
DRD Management, Inc. D/B/A DRD Knoxville Medical Clinic - Central	TX	1000	2/16/2012	Improper Disposal	Paper
Emory Healthcare	GA	315000	02/07/2012 - 02/20/2012	Unknown, Other	Other
Rex Smith, DPM -Rex Smith Podiatry 	OR	20915	2/19/2012	Theft	Desktop Computer
Desert AIDS Project	CA	4400	4/12/12	Theft	Desktop Computer
University of Arkansas for Medical Sciences	AR	7121	2/15/2012	Unauthorized Access/Disclosure	Other
TLC DENTAL DANIA, LLC	FL	750	4/23/2012	Theft	Paper
South Carolina Department of Health and Human Services	SC	228435	01/31/2012 - 04/02/2012	Unauthorized Access/Disclosure	E-mail
Oregon Health Authority	OR	550	4/13/2012	Theft	Paper
SHIELDS For Families 	CA	961	2/27/2012	Theft	Network Server
Safe Ride Services, Inc	AZ	42000	8/31/2011	Unauthorized Access/Disclosure, Hacking/IT Incident	Network Server
IntraCare North Hospital	TX	750	03/15/2011 - 08/18/2011	Theft	Paper
Oakland Vision Services, PC	MI	3000	4/9/12	Hacking/IT Incident	Network Server
Stephen Haggard, DPM Podiatry 	WA	1597	3/4/12	Theft	Network Server
Baptist Health System	AL	1655	3/8/12	Improper Disposal	Paper
University of Houston for UH College of Optometry	TX	7000	02/22/2012-02/23/2012	Unauthorized Access/Disclosure, Hacking/IT Incident	Network Server
Rite Aid Store 1343	WV	2905	3/26/2012	Theft	Paper
Iowa Department of Human Services	IA	3000	02/06/2012 - 03/14/2012	Improper Disposal	Paper
Hogan Services Inc. Health Care Premium Plan	MO	1134	3/30/2012	Unauthorized Access/Disclosure	E-mail
Family HealthServices Minnesota, P.A.	MN	4000	3/30/2012	Theft	Laptop
St. Mary Medical Center	CA	3900	5/7/12	Loss	Other Portable Electronic Device
Fairview Health Services	MN	623	7/25/2011	Theft	Laptop
Our Lady of the Lake Regional Medical Center	LA	17000	3/16/2012	Theft, Loss	Laptop
UnitedHealth Group health plan single affiliated covered entity	MN	19100	06/28/2011 - 12/12/2011	Unauthorized Access/Disclosure	Other
West Dermatology	CA	1900	04/21/2012 - 04/22/2012	Theft	Other
Duke University Health System	NC	591	04/21/2004-02/16/2012	Unauthorized Access/Disclosure	Other
Luz Colon, DPM  Podiatry 	FL	1137	3/20/2012	Theft, Loss	Laptop
Ameritas Life Insurance Corp. 	NE	3000	3/21/2012	Theft	Laptop
Children's Hospital Boston	MA	2159	3/25/2012	Theft	Laptop
Upper Valley Medical Center	OH	15000	10/01/2010-03/21/2012	Unauthorized Access/Disclosure	Other
Physician's Automated Laboratory	CA	745	03/23/2012 - 03/26/2012	Theft	Paper
Phoebe Putney Memorial Hospital, Inc. 	GA	12937	07/26/2010-03/29/2012	Theft	Electronic Medical Record, Paper
Independence Physical Therapy	CT	925	8/1/11	Theft	Desktop Computer
Titus Regional Medical Center	TX	5700	3/27/2012	Loss, Unknown	Laptop
Titus Regional Medical Center	TX	500	3/29/2012	Theft	Other
Lutheran Community Services Northwest	WA	756	03/29/2012-03/30/2012	Theft	Desktop Computer, Other Portable Electronic Device
Volunteer State Health Plan, Inc. 	TN	1102	03/16/2012-04/20/2012	Loss	Paper
Charlie Norwood VA Medical Center	GA	824	3/30/2012	Loss	Other Portable Electronic Device
Mid America Health, Inc.	IN	1444	4/6/12	Theft	Laptop
Metcare of Florida, Inc.	FL	2557	05/01/2012 - 05/02/2012	Theft	Other Portable Electronic Device
Robert Witham, MD, FACP	OR	11136	4/16/2012	Theft	Desktop Computer
Memorial Sloan-Kettering Cancer Center	NY	568	08/13/2009-04/12/2012	Theft	E-mail, Other	The covered entity's (CE) staff member disclosed an unencrypted Microsoft Excel graph to a non-covered entity physician who re-disclosed it to a medical education organization to be used  in a presentation.  In addition, the medical education organization posted the presentation slides on its website.  The graph contained the protected health information (PHI) of 569 individuals and included names, telephone numbers, social security numbers, ages, cities and states of residence, medical record numbers, and clinical information.  Upon discovery of the breach, the CE ensured that the information was removed from the website and deleted, sanctioned the workforce member responsible, and retrained its workforce on the use of a data loss prevention tool and the risks of embedded PHI.  As a result of OCR's investigation, the CE provided OCR with evidence of its technical safeguards and security awareness initiatives and provided assurance that it implemented the corrective action listed above.
Gessler Clinic, P.A.	FL	1409	05/03/2012-05/04/2012	Theft	Paper
University of Kentucky HealthCare	KY	4490	5/1/12	Theft	Laptop
Wolf & Yun	KY	824	4/24/2012	Theft	Laptop
Karen Kietzman	MT	708	4/22/2012	Theft	Laptop, Other Portable Electronic Device
Bruce G. Peller, DMD, PA	NC	9953	4/22/2012	Unauthorized Access/Disclosure	Desktop Computer
Sharon L. Rogers, Ph.D., ABPP	TX	585	6/16/2012	Theft	Laptop
Health Texas Provider Network - Cardiovascular Consultants of North Texas	TX	2462	03/16/2012 - 05/11/2012	Unauthorized Access/Disclosure	Electronic Medical Record
SwedishAmerican Health System	IL	1500	5/31/2012	Theft	Paper
River Arch Dental	CA	2533	5/12/12	Loss, Unauthorized Access/Disclosure, Unknown	Other Portable Electronic Device
Hamner Square Dental 	CA	1112	5/12/12	Theft, Loss, Unauthorized Access/Disclosure, Unknown	Other Portable Electronic Device
Visiting Nurse Services of Iowa	IA	1298	5/27/2012	Theft	Paper
Molalla Family Dental	OR	4354	5/17/2012	Unauthorized Access/Disclosure, Hacking/IT Incident, Other	Network Server
Pamlico Medical Equipment LLC	NC	2917	5/16/2012	Loss	Other Portable Electronic Device
Beth Israel Deaconess Medical Center	MA	3900	5/22/2012	Theft	Laptop
NYU School of Medicine Faculty Group Practice	NY	8488	5/22/2012	Theft	Desktop Computer
Adult & Child Center, Inc.	IN	550	5/10/12	Hacking/IT Incident	Other
The Surgeons of Lake County, LLC	IL	7067	06/22/2012-06/25/2012	Other	Network Server
Kindred Healthcare Inc d/b/a Kindred Transitional Care and Rehabilitation-Sellersburg	IN	1504	06/01/2012-06/04/2012	Theft	Other
Jeffrey Paul Edelstein M.D.	AZ	4800	5/28/2012	Theft	Network Server
Northwestern Memorial Hospital	IL	4211	6/11/12	Theft	Laptop, Other Portable Electronic Device
Walgreen Co.	IL	1240	7/5/12	Theft	Paper
VNA HealthCare	CT	7461	6/25/2012	Theft	Laptop
Hartford Hospital	CT	2097	6/25/2012	Theft	Laptop
Diversified Support Services	IN	505	5/10/12	Hacking/IT Incident	Other
Oregon Health & Science University	OR	702	7/4/12	Theft	Other
Stanford Hospital & Clinics and School of Medicine	CA	2300	07/15/2012 - 07/16/2012	Theft	Desktop Computer
Midtown Mental Health Center	IN	890	5/10/12	Hacking/IT Incident	Other
Harris County Hospital District	TX	2875	04/14/2008 - 02/28/2011	Theft	Electronic Medical Record, Paper
Howard University Hospital	DC	66601	1/25/2012	Theft	Laptop
TEMPLE COMMUNITY HOSPITAL	CA	603	7/3/12	Theft	Desktop Computer
Memorial Healthcare System	FL	105646	01/01/2011 - 07/05/2012	Theft	Electronic Medical Record
Liberty Resources, Inc.	PA	3183	8/4/12	Theft	Laptop	An employee's personal laptop computer that contained the unencrypted electronic protected health information (ePHI) of 3,183 individuals was stolen from his vehicle.  The ePHI involved in the breach included consumer names, identification numbers, diagnosis codes,  base service unit numbers, service start and end dates, service names, procedure codes, service location identifiers, units authorized, units utilized, units cost, total authorization amounts, total utilized amounts, authorization dates, funding sources, provider names, and master provider index numbers.  The CE timely notified all affected individuals, the media, and HHS, and offered assistance to consumers who wished to place fraud alerts on their consumer credit files.  Following the breach, the CE created and implemented a new policy and procedure to improve safeguards.  This policy prohibits downloading any PHI to a home computer or portable device, prohibits forwarding emails containing PHI to a personal account, cloud service, or unauthorized user, and requires full-disk encryption of agency laptops.  OCR obtained assurances that the CE implemented the corrective action listed above. 
The University of Texas MD Anderson Cancer Center	TX	2264	7/13/2012	Loss	Other Portable Electronic Device
Central States Southeast and Siouthwest Areas Health & Welfare Fund	IL	754	7/31/2012	Unauthorized Access/Disclosure, Other	Paper
LANA MEDICAL CARE	FL	500	8/18/2012	Theft	Laptop
Cancer Care Group, P.C.	IN	55000	7/19/2012	Theft	Other Portable Electronic Device
Tricounty Behavioral Health Clinic	GA	4000	8/26/2012	Theft	Laptop
Sierra Plastic Surgery	NV	800	08/19/2011-09/20/2011	Unauthorized Access/Disclosure, Hacking/IT Incident	Network Server
Charlotte Clark-Neitzel, MD	WA	942	7/24/2012	Theft	Laptop
University of Miami	FL	64846	7/18/2012	Unauthorized Access/Disclosure, Other	Paper
University of New Mexico Health Sciences Center	NM	2365	5/21/2012	Hacking/IT Incident	Network Server
Valley Plastic Surgery, P.C.	VA	4873	7/15/2012	Theft	Other Portable Electronic Device
Colon & Digestive Health Specialists	AR	5713	7/16/2012	Loss	Other Portable Electronic Device
BHcare, Inc	CT	5827	7/19/2012	Theft	Laptop, Other Portable Electronic Device
The Feinstein Institute for Medical Research	NY	13000	9/2/12	Theft	Laptop
St. Therese Medical Group, Inc	CA	3031	7/22/2012	Theft	Desktop Computer
