Name_of_Covered_Entity	State	Individuals_Affected	Date_of_Breach	Type_of_Breach	Location_of_Breached_Information	Summary
Brooke Army Medical Center	TX	1000	10/16/2009	Theft	Paper	A binder containing the protected health information (PHI) of up to 1,272 individuals was stolen from a staff member's vehicle.  The PHI included names, telephone numbers, detailed treatment notes, and possibly social security numbers.  In response to the breach, the covered entity (CE) sanctioned the workforce member and developed a new policy requiring on-call staff members to submit any information created during their shifts to the main office instead of adding it to the binder.  Following OCR's investigation, the CE notified the local media about the breach.
Mid America Kidney Stone Association, LLC	MO	1000	9/22/2009	Theft	Network Server	Five desktop computers containing unencrypted electronic protected health information (e-PHI) were stolen from the covered entity (CE).  Originally, the CE reported that over 500 persons were involved, but subsequent investigation showed that about 260 persons were involved.  The ePHI included demographic and financial information. The CE provided breach notification to affected individuals and HHS.  Following the breach, the CE improved physical security by installing motion detectors and alarm systems security monitoring.  It improved technical safeguards by installing enhanced antivirus and encryption software.  As a result of OCR's investigation the CE updated its computer password policy.  
Alaska Department of Health and Social Services	AK	501	10/12/09	Theft	Other Portable Electronic Device, Other
Health Services for Children with Special Needs, Inc.	DC	3800	10/9/09	Loss	Laptop	A laptop was lost by an employee while in transit on public transportation.  The computer contained the protected health information of 3800 individuals.  The protected health information involved in the breach included names, Medicaid ID numbers, dates of birth, and primary physicians.  In response to this incident, the covered entity took steps to enforce the requirements of the Privacy & Security Rules.  The covered entity has installed encryption software on all employee computers, strengthened access controls including passwords, reviewed and updated security policies and procedures, and updated it risk assessment.  In addition, all employees received additional security training.  
L. Douglas Carlson, M.D.	CA	5257	9/27/2009	Theft	Desktop Computer	A shared Computer that was used for backup was stolen on 9/27/09 from the reception desk area of the covered entity. The Computer contained certain electronic protected health information (ePHI) of 5,257 individuals who were patients of the CE.  The ePHI involved in the breach included names, dates of birth, and clinical information, but there were no social security numbers, financial information, addresses, phone numbers, or other ePHI in any of the reports on the disks or the hard drive on the stolen Computer. Following the breach, the covered entity notified all 5,257 affected individuals and the appropriate media; added technical safeguards of encryption for all ePHI stored on the USB flash drive or the CD used on the replacement computer; added physical safeguards by keeping new portable devices locked when not in use in a secure combination safe in doctor's private office or in a secure filing cabinet; and added administrative safeguards by requiring annual refresher retraining of CE staff for Privacy and Security Rules as well as requiring immediate retraining of cleaning staff in both Rules.
David I. Cohen, MD	CA	857	9/27/2009	Theft	Desktop Computer	A shared Computer that was used for backup was stolen from the reception desk area, behind a locked desk area, probably while a cleaning crew had left the main door to the building open and the door to the suite was unlocked and perhaps ajar.  The Computer contained certain electronic protected health information (ePHI) of 857 patients.  The ePHI involved in the breach included names, dates of birth, and clinical information.  Following the breach, the covered entity notified all affected individuals and the media, added technical safeguards of encryption for all ePHI stored on the USB flash drive or the CD used on the replacement computer, added physical safeguards by keeping new portable devices locked when not in use in a secure combination safe in doctor's private office or in a secure filing cabinet, and added administrative safeguards by requiring annual refresher retraining staff for Privacy and Security Rules as well as requiring immediate retraining of cleaning staff in both Rules, which has already taken place.
Michele Del Vicario, MD	CA	6145	9/27/2009	Theft	Desktop Computer	A shared Computer that was used for backup was stolen on 9/27/09 from the reception desk area of the covered entity.  The Computer contained certain electronic protected health information (ePHI) of 6,145 individuals who were patients of the CE, The ePHI involved in the breach included names, dates of birth, and clinical information, but there were no social security numbers, financial information, addresses, phone numbers, or other ePHI in any of the reports on the disks or the hard drive on the stolen Computer. Following the breach, the CE: notified all  6,145 affected individuals and the appropriate media;  added technical safeguards of encryption for all ePHI stored on the USB flash drive or the CD used on the replacement computer; all passwords are strong; all computers are password protected; added physical safeguards by keeping new portable devices locked when not in use in a secure combination safe in doctor's private office or in a secure filing cabinet; and added administrative safeguards by requiring annual refresher retraining of CE staff for Privacy and Security Rules as well as requiring immediate retraining of cleaning staff in both Rules, which has already taken place. 
Joseph F. Lopez, MD	CA	952	9/27/2009	Theft	Desktop Computer	A shared Computer that was used for backup was stolen on 9/27/09. The Computer contained certain electronic protected health information (ePHI) of 952 patients. Following the breach, the covered entity notified all 952 affected individuals and the appropriate media; added technical safeguards of encryption for all ePHI stored on the USB flash drive or the CD used on the replacement computer; added physical safeguards by keeping new portable devices locked when not in use in a secure combination safe in doctor's private office or in a secure filing cabinet; and added administrative safeguards by requiring annual refresher retraining of staff for Privacy and Security Rules. 
Mark D. Lurie, MD	CA	5166	9/27/2009	Theft	Desktop Computer	A shared Computer that was used for backup was stolen on 9/27/09 from the reception desk area of the covered entity.  The Computer contained certain electronic protected health information (ePHI) of 5,166 individuals who were patients of the CE, The ePHI involved in the breach included names, dates of birth, and clinical information, but there were no social security numbers, financial information, addresses, phone numbers, or other ePHI in any of the reports on the disks or the hard drive on the stolen Computer. Following the breach, the CE: notified all 5,166 affected indiv's and the appropriate media;  added technical safeguards of encryption for all ePHI stored on the USB flash drive or the CD used on the replacement computer; all passwords are strong; all computers are password protected; added physical safeguards by keeping new portable devices locked when not in use in a secure combination safe in doctor's private office or in a secure filing cabinet; and added administrative safeguards by requiring annual refresher retraining of CE staff for Privacy and Security Rules as well as requiring immediate retraining of cleaning staff in both Rules, which has already taken place. 
City of Hope National Medical Center	CA	5900	9/27/2009	Theft	Laptop	A laptop computer was stolen from a workforce member's car. The laptop computer contained the protected health information of approximately 5,900 individuals. Following the breach, the covered entity encrypted all protected health information stored on lap tops.  Additionally, OCR's investigation resulted in the covered entity improving their physical safeguards and retraining employees.
The Children's Hospital of Philadelphia	PA	943	10/20/2009	Theft	Laptop
Cogent Healthcare of Wisconsin, S.C.	TN	6400	10/11/09	Theft	Laptop	A laptop was stolen from a locked office at the Aurora St. Lukes Medical Center.  The laptop contained protected health information pertaining to 6,400 individuals.  The information included patient names, dates of birth, social security numbers, medical record numbers, and in some cases diagnosis codes.  In response to the theft, the hospital implemented several corrective action measures, including accelerated efforts to encrypt all laptop hard drives, improved physical locks on the office where the theft occurred, staff training regarding the appropriate use and storage of devices containing ePHI, and encryption of portable flash drives and Blackberry devices.
Universal American	NY	83000	11/12/09	Other	Paper	In its breach report and during the course of OCR's investigation, the covered entity advised that it took various corrective actions to prevent a reoccurrence of the breach.  Specifically, the covered entity conducted a risk assessment which revealed that the breach posed a significant risk of financial, reputational, or other harm to the 83,000 members.  The covered entity sent notification letters to 83,000 members apologizing for the breach and offered a year of free credit monitoring and a $25,000 insurance policy against identity theft ($10,000 for New York residents).  The covered entity also provided training to its call centers on November 29, 2009 to answer inquiries from callers concerned about the breach.  In addition, media outlets were contacted to alert of a breach in states in which more than 500 members were impacted by the breach.  The covered entity advised that media outlets were identified based on location of membership impacted, as well as ensuring it was a major media outlet and press releases were sent to 21 major media outlets on December 18, 2009.  The covered entity also created and implemented a new policy titled 'Personal Health Information and Personal Identifiable Information Data Security and Handling Policy Acknowledgement Form'  that centralized all data requests through a 'Team Track'  which is an internal electronic submission request that ensures all PHI requested data receives the sign off of the Privacy Officer and Security Officer prior to release.  Further, the covered entity also provided a mandatory annual computer-based training to all staff in May 2010.
Kern Medical Center	CA	596	10/31/2009	Theft	Other
Keith W. Mann, DDS, PLLC	NC	2000	12/8/09	Hacking/IT Incident	Desktop Computer, Network Server, Electronic Medical Record
Detroit Department of Health and Wellness Promotion	MI	10000	10/22/2009	Theft	Other Portable Electronic Device
Detroit Department of Health and Wellness Promotion	MI	646	11/26/2009	Theft	Laptop, Desktop Computer	A desktop and four laptop computers were stolen from the covered entity's locked facility.  The protected health information involved in the breach included names, addresses, dates of birth, social security numbers, types of services received, and Medicare/Medicaid numbers.Following the breach, the covered entity installed new office door locks with assigned keys, installed security cameras with alarms, and physically secured computers to desks.  The covered entity now stores billing information in its patient management system, and it ensured that no electronic protected health information was stored locally. Additionally, OCR's investigation resulted in the covered entity providing training to workforce members regarding the incident
University of California, San Francisco	CA	610	9/22/2009	Other	E-mail
Daniel J. Sigman MD PC	MA	1860	12/11/09	Theft	Other Portable Electronic Device, Other, Electronic Medical Record	Computer backup tapes containing EPHI for the office practice management program including electronic medical records were stolen from the home of the practice manager on December 11, 2009.   The breach affected approximately 1,860 patients. The protected health information on the tapes contained patients' names, addresses, telephone numbers, dates of birth, insurance information, social security numbers and medical record information.  Following the breach, Sigman took the following voluntary corrective actions: (1) upgraded software application for backup security; implemented a new external backup system in case the server goes down; (2) encryption software was implemented for data contained on both its backup tapes and network storage device; (3) revised its security policy for transporting backup media; backup tapes must now be stored in a lockbox within a locked office in its facility; the revised policy also prohibits the movement of backup tapes from the facility as well as restricts access to the tapes to designated workforce; (4) employees were retrained on the policies and procedures in place and received training on the new policies and procedures for safeguarding backup tapes; (5) notified affected individuals and the media. 
Massachusetts Eye and Ear Infirmary	MA	1076	11/10/09	Theft	Other
BlueCross BlueShield Association	DC	3400	10/26/2009	Theft	Paper	The covered entity's (CE) business associate (BA) incorrectly updated contract holders' addresses and mailed protected health information (PHI) to the wrong address of approximately 3,400 individuals.  The PHI involved included demographic information, explanations of benefits, clinical information, and diagnoses.  The breach incident involved a BA and occurred prior to the September 23, 2013, compliance date.  Upon discovery of the breach, the CE obtained assurances that the BA took steps to enforce the requirements of the BA agreement.  Specifically, the BA updated its processes and created an incident tracking report.  In addition, a contract was executed for a new vendor to handle mail address verification. Following OCR's investigation, the BA improved its code review process to catch the system error that caused this incident and instituted a manual quality review process.  OCR verified that the CE had a proper BA agreement in place that restricted the BA's use and disclosure of PHI and required the BA to safeguard all PHI.
BlueCross BlueShield Association	DC	15000	10/7/09	Theft	Paper	The covered entity's (CE) business associate (BA) mailed protected health information (PHI) of approximately 15,000 individuals to incorrect addresses due to an error in its quarterly address update process.  The mailing contained demographic information, explanations of benefits, clinical information, and diagnoses. Upon discovery of the breach, the CE collected the returned mail and verified that it had not been delivered, and updated its HIPAA policies and procedures. Following OCR's investigation, the CE was able to recover all or nearly all of the misdirected envelopes. 
Kaiser Permanente Medical Care Program	CA	15500	12/1/09	Theft	Other Portable Electronic Device, Other
Blue Island Radiology Consultants	IL	2562	12/9/09	Theft	Other	The covered entity's (CE's) business associate (BA) mailed a package to the CE that was supposed to contain a backup data tape and compact disc containing protected health information (PHI); however, the tape was not in the package when delivered.  Approximately 2,000 individuals were affected by the breach. The PHI included demographic, financial, and clinical information.  The CE provided breach notification to affected individuals, HHS, and the media.  Following the breach, the CE revised its procedures for back up data storage instead of sending tapes via the mail.  Following OCR's investigation, the CE continued to reevaluate ways to enhance administrative, physical, and technical safeguards.
Goodwill Industries of Greater Grand Rapids, Inc.	MI	10000	12/15/2009	Theft	Other	On December 15, 2009, a safe was stolen from Goodwill's off-site facility, which contained five unencrypted back-up tapes.  The breach affected approximately 10,000 individuals.  The protected health information involved in the breach included full names, addresses, dates of birth, reasons for referral, dates of service, miscellaneous demographics, and, in some cases, Social Security numbers.  The covered entity moved the off-site storage of back-up tapes to a new site controlled by Goodwill.  The tapes are now kept in a commercial grade safe with a combination lock.  The actions taken by Goodwill prior to OCR's formal investigation brought the covered entity into compliance.  
Children's Medical Center of Dallas	TX	3800	11/19/2009	Loss	Other Portable Electronic Device, Other
Concentra	TX	900	11/19/2009	Theft	Laptop
Ashley and Gray DDS	MO	9309	1/10/10	Theft	Desktop Computer
Advocate Health Care	IL	812	11/24/2009	Theft	Laptop	On November 24, 2009, an Advocate nurse's laptop computer was stolen.  The missing laptop computer contained the protected health information of approximately 812 individuals.  The protected health information involved in the breach included name, address, dates of birth, social security numbers, insurance information, medication, and diagnoses. Following the breach, Advocate specifically addressed mobile device security and accepted use. Additionally, OCR's investigation resulted in Advocate workforce members that use mobile devices are now required to fill out and submit an acknowledgment form that establish proper administrative, technical, and physical security safeguards.  
The Methodist Hospital	TX	689	1/18/2010	Theft	Other	An unencrypted laptop computer was stolen from the covered entity's unlocked testing office.  The laptop computer contained the protected health information of approximately 689 individuals.  The protected health information involved in the breach included names, dates of birth, Social Security numbers, and the age, gender, race, and medication information of affected individuals.  Following the breach, the covered entity restricted the storage of electronic protected health information to network drives.  Additionally, OCR's investigation resulted in the covered entity improving their physical safeguards and in retraining employees.
University of California, San Francisco	CA	7300	11/30/2009	Theft	Laptop
Carle Clinic Association	IL	1300	1/13/2010	Theft	Other, Paper
Educators Mutual Insurance Association of Utah 	UT	5700	12/27/2009	Theft	Other
University Medical Center of Southern Nevada	NV	5103	10/31/2009	Theft	Paper	Between the dates of July 31, 2009 and November 19, 2009, a former UMC volunteer faxed patient face sheets to an attorney who used the sheets to contact prospective clients.  Although UMC only had proof of two disclosures, it chose to notify all 5,301 individuals that could have been affected by the breach.  The protected health information involved in the breach included names, addresses, dates of birth, social security numbers, and diagnoses.  Following the breach, UMC conducted an internal investigation, notified all 5,301 individuals, notified the media, and notified the Secretary.  Additionally, UMC reformulated face sheets so that they no longer include full social security numbers and provided all possible affected individuals with a year of free credit monitoring.  As a result of this breach, at least one person has been indicted on one count of conspiracy to illegally disclose personal health information in violation of the HIPAA
Center for Neurosciences	AZ	1100	12/15/2009	Theft	Laptop
Brown University	RI	528	12/11/09	Other	Paper	On January 5, 2010, BCBSRI was notified that a 16 page report pertaining to Brown University's health plan was impermissibly disclosed to two other BCBSRI agents.  The reports contained the PHI of approximately 528 individuals.  The PHI involved: first and last names, dates of service, cost of medical care provided, and member identification numbers.  Following the breach, BCBSRI recovered the reports, received written assurances that any electronic copies of the reports were deleted, notified affected individuals of the breach, implemented new procedure for all outgoing correspondence, and is in the process of auditing all affected members' claim history to ensure no fraud.
MMM Heath Care Inc. 	PR	1907	2/4/10	Theft	Paper	The covered entity's (CE) business associate (BA) erroneously merged two lists which led to the disclosure of protected health information (PHI) of 1,907 individuals.  The PHI included names, internal identification numbers, and the number of emergency room visits.  Upon discovery of the breach, the CE's BA established a quality control process in order to ensure adequate safeguards for that letters that are sent by mail.  As a result of OCR's investigation, the CE created and implemented additional policies and procedures for quality control of mailings.  The CE also provided training to all staff on its revised privacy and security policies and procedures.
PMC Medicare Choice	PR	605	2/4/10	Theft	Paper	The covered entity's (CE) business associate (BA) erroneously merged two lists which led to the disclosure of protected health information (PHI) of 605 individuals.  The PHI included names, internal identification numbers, and the number of emergency room visits.  Upon discovery of the breach, the CE's BA established a quality control process in order to ensure adequate safeguards for that letters that are sent by mail.  As a result of OCR's investigation, the CE created and implemented additional policies and procedures for quality control of mailings.  The CE also provided training to all staff on its revised privacy and security policies and procedures.
Cardiology Consultants/Baptist Health Care Corporation	FL	8000	12/19/2009	Theft	Desktop Computer	A desktop computer that contained the e-PHI of approximately 8,000 individuals was stolen from the covered entity's (CE) locked medical suite.  The PHI involved in the breach included names, dates of birth, medical record numbers, ultrasound information, exam dates, and reasons for the ultrasound.  The computer that was stolen used proprietary software and a special electronic key to access the PHI.  The CE provided breach notification to affected individuals, HHS, and the media and posted substitute notification on its website.  Following the breach, the CE worked with law enforcement to identify the possible suspect.  The CE upgraded its facility access controls to include proximity card readers for every location that stores PHI.  As a result of OCR's investigation the CE updated its risk analysis and carried out additional risk management activities.  
State of TN, Bureau of TennCare	TN	3900	12/23/2009	Theft	Paper	The covered entity (CE) mailed the wrong information to 3,900 individuals based on a corrupted data file it received from a state agency.  The types of PHI involved were names, dates of birth, social security numbers, member identification numbers, and in some cases, diagnoses, treatments, conditions, and medications.  Following the breach, the CE immediately fixed the corrupted file and mailed corrected letters.  The CE provided breach notification to HHS, the media, and affected individuals and provided substitute notification by posting on its website.  It also offered affected individuals one year of free credit monitoring and comprehensive credit services.  The CE also worked with the state agency to implement a new procedure to improve safeguards for PHI.  OCR obtained assurances that the CE implemented the corrective action listed above.
Lucille Packard Children's Hospital	CA	532	1/11/10	Other	Desktop Computer
University of New Mexico Health Sciences Center	NM	1900	2/8/10	Other	Desktop Computer
Advanced NeuroSpinal Care	CA	3500	12/30/2009	Theft	Network Server	A computer containing the electronic protected health information (ePHI) of 3,500 individuals was stolen from the office of a covered entity (CE).  The ePHI included patient names, addresses, dates of birth, social security numbers, driver's licenses, claims information, diagnoses, and conditions. As a result of the loss, the CE upgraded the alarm system and replaced the server housing and storage security lock-up.  The CE also notified affected individuals, the media, appropriate government agencies, and law enforcement.  In addition, the CE established an office-based hotline to assist affected individuals.  As a result of OCR's investigation, the CE has implemented regularly scheduled security risk analyses and has installed window bars, roll down shutters, four video surveillance cameras, and other physical security measures to prevent theft.
Aspen Dental Care P.C.	CO	2500	10/4/09	Theft	Other	A computer hard drive containing encrypted patient records was stolen from the covered entity's (CE) safe.  The hard drive contained clinical and demographic information of approximately 2,500 patients.  Following the breach, the CE provided additional training to its staff.  OCR obtained assurances that the CE implemented the corrective action listed above.
