Name_of_Covered_Entity	State	Individuals_Affected	Date_of_Breach	Type_of_Breach	Location_of_Breached_Information	Summary
Mills-Peninsula Health Services	CA	1500	11/1/09	Unauthorized Access/Disclosure	Paper
Brigham and Women's Hospital and Faulkner Hospital 	MA	638	6/21/2011	Theft	Other Portable Electronic Device	A covered entity's (CE) workforce member lost an external hard drive containing the electronic protected health information (ePHI) of 638 individuals while traveling.  The external hard drive included names, medical record numbers, dates of admission, medications, diagnoses, and treatment information.  The CE notified HHS, the media, and all individuals affected regarding the breach and provided individuals with identity protection services.  Following the breach, the CE sanctioned the workforce member involved and retrained the workforce member and division staff on  safeguards for ePHI.  In addition, the CE established a mitigation workgroup to review policies and procedures regarding the protection of ePHI and created a new external hard drive encryption policy.  OCR obtained assurances that the CE  implemented the corrective action listed above.
Ashley Industrial Molding, Inc. Employee Welfare Benefit Plan 	IN	506	5/9/11	Hacking/IT Incident	Network Server
Monmouth Medical Center	NJ	6443	6/24/2011	Theft	Other Portable Electronic Device, Other	An unencrypted hard drive containing the electronic protected health information (ePHI) of 6,443 individuals was stolen from an employee of the covered entity's (CE) business associate (BA), MedAssets.  The ePHI included names, dates of birth, social security number, account numbers, medical record numbers, charges incurred, amounts paid, admission and discharge dates, and information regarding health insurance and eligibility for applicable governmental benefit programs.  Upon discovery of the breach, the CE, Monmouth Medical Center, filed a police report, provided breach notification to HHS, the media, and affected individuals, and posted substitute notification on its website.  As a result of OCR's investigation, the BA retrained the employee, instructed all employees to stop using any type of external storage device that contains ePHI, and recalled and destroyed all unencrypted external hard drives that contained ePHI.  In addition, the BA improved technical safeguards by encrypting external hard drives and installing a new software system that monitors, controls and encrypts data leaving the BA's computers.  The BA also hired an IT security analyst to supplement its security program.  The breach incident involved a BA and occurred prior to the September 23, 2013, compliance date.  OCR verified that the CE had a proper BA agreement in place that restricted the BA's use and disclosure of PHI and required the BA to safeguard all PHI.
Clara Maass Medical Center	NJ	8795	6/24/2011	Theft	Other Portable Electronic Device, Other	An unencrypted hard drive containing the electronic protected health information (ePHI) of 8,795 individuals was stolen from an employee of the covered entity's (CE) business associate (BA), MedAssets.  The ePHI included names, dates of birth, social security number, account numbers, medical record numbers, charges incurred, amounts paid, admission and discharge dates, and information regarding health insurance and eligibility for applicable governmental benefit programs.  Upon discovery of the breach, the CE, Clara Maass Medical Center, filed a police report, provided breach notification to HHS, the media, and affected individuals, and posted substitute notification on its website.  As a result of OCR's investigation, the BA retrained the employee, instructed all employees to stop using any type of external storage device that contains ePHI, and recalled and destroyed all unencrypted external hard drives that contained ePHI.  In addition, the BA improved technical safeguards by encrypting external hard drives and installing a new software system that monitors, controls and encrypts data leaving the BA's computers.  The BA also hired an IT security analyst to supplement its security program.  The breach incident involved a BA and occurred prior to the September 23, 2013, compliance date.  OCR verified that the CE had a proper BA agreement in place that restricted the BA's use and disclosure of PHI and required the BA to safeguard all PHI.
Newark Beth Israel Medical Center	NJ	15015	6/24/2011	Theft	Other Portable Electronic Device, Other	An unencrypted hard drive containing the electronic protected health information (ePHI) of 15,015 individuals was stolen from an employee of the covered entity's (CE) business associate (BA), MedAssets.  The ePHI included names, dates of birth, social security number, account numbers, medical record numbers, charges incurred, amounts paid, admission and discharge dates, and information regarding health insurance and eligibility for applicable governmental benefit programs.  Upon discovery of the breach, the CE, Newark Beth Israel Medical Center, filed a police report, provided breach notification to HHS, the media, and affected individuals, and posted substitute notification on its website.  As a result of OCR's investigation, the BA retrained the employee, instructed all employees to stop using any type of external storage device that contains ePHI, and recalled and destroyed all unencrypted external hard drives that contained ePHI.  In addition, the BA improved technical safeguards by encrypting external hard drives and installing a new software system that monitors, controls and encrypts data leaving the BA's computers.  The BA also hired an IT security analyst to supplement its security program.  The breach incident involved a BA and occurred prior to the September 23, 2013, compliance date.  OCR verified that the CE had a proper BA agreement in place that restricted the BA's use and disclosure of PHI and required the BA to safeguard all PHI.
Saint Barnabas Medical Center	NJ	6179	6/24/2011	Theft	Other Portable Electronic Device, Other	An unencrypted hard drive containing the electronic protected health information (ePHI) of 6,179 individuals was stolen from an employee of the covered entity's (CE) business associate (BA), MedAssets.  The ePHI included names, dates of birth, social security number, account numbers, medical record numbers, charges incurred, amounts paid, admission and discharge dates, and information regarding health insurance and eligibility for applicable governmental benefit programs.  Upon discovery of the breach, the CE, Saint Barnabas Medical Center, filed a police report, provided breach notification to HHS, the media, and affected individuals, and posted substitute notification on its website.  As a result of OCR's investigation, the BA retrained the employee, instructed all employees to stop using any type of external storage device that contains ePHI, and recalled and destroyed all unencrypted external hard drives that contained ePHI.  In addition, the BA improved technical safeguards by encrypting external hard drives and installing a new software system that monitors, controls and encrypts data leaving the BA's computers.  The BA also hired an IT security analyst to supplement its security program.  The breach incident involved a BA and occurred prior to the September 23, 2013, compliance date.  OCR verified that the CE had a proper BA agreement in place that restricted the BA's use and disclosure of PHI and required the BA to safeguard all PHI.
Washington State Department of Social and Health Services	WA	3950	7/1/11	Unauthorized Access/Disclosure	Paper
St. Francis Hospital	DE	948	6/1/11	Loss	Other Portable Electronic Device, Other
Reznick Group, P.C.	MD	2459	5/9/11	Hacking/IT Incident	Network Server
The Neurological Institute of Savannah & Center for Spine	GA	63425	7/2/11	Theft	Other Portable Electronic Device, Other
Kimball Medical Center	NJ	6785	6/24/2011	Theft	Other Portable Electronic Device, Other	An unencrypted hard drive containing the electronic protected health information (ePHI) of 6,785 individuals was stolen from an employee of the covered entity's (CE) business associate (BA), MedAssets.  The ePHI included names, dates of birth, social security number, account numbers, medical record numbers, charges incurred, amounts paid, admission and discharge dates, and information regarding health insurance and eligibility for applicable governmental benefit programs.  Upon discovery of the breach, the CE, Kimball Medical Center, filed a police report, provided breach notification to HHS, the media, and affected individuals, and posted substitute notification on its website.  As a result of OCR's investigation, the BA retrained the employee, instructed all employees to stop using any type of external storage device that contains ePHI, and recalled and destroyed all unencrypted external hard drives that contained ePHI.  In addition, the BA improved technical safeguards by encrypting external hard drives and installing a new software system that monitors, controls and encrypts data leaving the BA's computers.  The BA also hired an IT security analyst to supplement its security program.  The breach incident involved a BA and occurred prior to the September 23, 2013, compliance date.  OCR verified that the CE had a proper BA agreement in place that restricted the BA's use and disclosure of PHI and required the BA to safeguard all PHI.
Community Medical Center	NJ	6950	6/24/2011	Theft	Other Portable Electronic Device, Other	An unencrypted hard drive containing the electronic protected health information (ePHI) of 6,950 individuals was stolen from an employee of the covered entity's (CE) business associate (BA), MedAssets.  The ePHI included names, dates of birth, social security number, account numbers, medical record numbers, charges incurred, amounts paid, admission and discharge dates, and information regarding health insurance and eligibility for applicable governmental benefit programs.  Upon discovery of the breach, the CE, Community Medical Center, filed a police report, provided breach notification to HHS, the media, and affected individuals, and posted substitute notification on its website.  As a result of OCR's investigation, the BA retrained the employee, instructed all employees to stop using any type of external storage device that contains ePHI, and recalled and destroyed all unencrypted external hard drives that contained ePHI.  In addition, the BA improved technical safeguards by encrypting external hard drives and installing a new software system that monitors, controls and encrypts data leaving the BA's computers.  The BA also hired an IT security analyst to supplement its security program.  The breach incident involved a BA and occurred prior to the September 23, 2013, compliance date.  OCR verified that the CE had a proper BA agreement in place that restricted the BA's use and disclosure of PHI and required the BA to safeguard all PHI.
American Health Medicare 	PR	5848	6/1/11	Theft	Other	The covered entity's (CE) business associate (BA) erroneously sent explanation of benefits letters (EOBs) containing the protected health information (PHI) of 5,848 individuals to other individuals.  The PHI included names, addresses, current procedural terminology codes (CPT), explanations of CPT codes, providers' names, and dates of service.  Upon discovery of the breach, the CE provided notice to the individuals affected by the breach but did not notify the media.  As a result of OCR's investigation, OCR provided technical assistance regarding the requirements of the Breach Notification Rule to the CE and the CE published a media notice.  In addition, the CE developed policies and procedures requiring quality control checks on the BA.  In addition, the BA adopted a new software system that validates the contents of the EOBs prior to mailing.  The breach incident involved a BA and occurred prior to the September 23, 2013, compliance date.  OCR verified that the CE had a proper BA agreement in place that restricted the BA's use of PHI and required the BA to safeguard all PHI.
Texas Health Presbtyerian Hospital Flower Mound	TX	10345	6/21/2011	Theft	Laptop
Capron Rescue Squad District	IL	815	2/5/11	Unauthorized Access/Disclosure	Laptop
Cook County Health & Hospitals System	IL	32008	6/24/2011	Theft	Other Portable Electronic Device, Other
Lexington VAMC	KY	1432	5/23/2011	Theft	Laptop, Other Portable Electronic Device, Paper	The covered entity's (CE) workforce member impermissibly stored the protected health information (PHI) of 1,432 individuals in a personal computer and other portable electronic media in order to conduct research. The PHI included social security numbers, names, initials, ages, and diagnoses.  Additional PHI was found in the workforce member's residence.  The CE provided breach notification to a total of 1,890 affected individuals and HHS.  Following the breach, the responsible workforce member is no longer employed by the CE.
Dr. Victoria Falcone, Falcone Cosmetic Services, PC, Falcone Cosmetic Services of NJ, PC	PA	3000	8/14/2011	Theft, Unauthorized Access/Disclosure	Laptop, Desktop Computer, Network Server, E-mail, Other Portable Electronic Device, Other, Electronic Medical Record, Paper
HEALTH RESEARCH INSTITUTE, INC., PFEIFFER TREATMENT CENTER	IL	2000	7/1/11	Theft	Desktop Computer, Network Server
Stanford Hospital & Clinics	CA	19651	9/9/10	Unauthorized Access/Disclosure	Other
Muir Orthopaedic Specialists, A Medical Group Inc.	CA	1800	7/27/2011	Theft	Paper
NEA Baptist Clinic	AR	3116	7/12/11	Hacking/IT Incident	Network Server
Jonathan Noel MD	IN	2059	7/13/2011	Theft	Other Portable Electronic Device, Other
Texas Health and Human Services Commission	TX	1696	3/10/11	Theft	Laptop	An unencrypted laptop was stolen from an employee's vehicle.  The laptop contained the ePHI of 1,696 patients.  The information at issue included patient names, dates of birth, gender, Medicaid identification numbers, procedure codes and diagnosis. Following discovery of the breach, the CE notified affected patients and notified the media. Following the breach, the CE confirmed encryption of laptops per CE's policy and sanctioned three involved employees.   
University of Wisconsin Oshkosh	WI	3000	7/18/2011	Hacking/IT Incident	Desktop Computer
Centro de Ortodoncia Inc.	PR	2000	5/6/10	Theft	Paper	OCR opened an investigation of the covered entity (CE), Dr. Pedro Valentin, after it reported boxes containing the protected health information (PHI) of 2,000 individuals were moved from the CE's office.  The PHI included names, account numbers, responsible party in charge of account, and method of payment.  OCR's investigation revealed that the individual who removed the PHI was the CE's wife and business partner.  The CE advised OCR that he knew his wife/partner was removing the boxes for the purpose of ascertaining the amount of monies the CE was receiving and that he is in the process of dissolving the partnership.  OCR concluded that the actions alleged in the breach report did not amount to a breach.
John T. Melvin, M.D.& Associates	TX	2541	8/9/11	Theft	Paper
Diversified Resources, Inc.	GA	863	8/11/11	Theft	Laptop
VA Gulf Coast Veterans Health Care System	MS	1797	7/21/2011	Theft	Paper	The covered entity (CE), U.S. Department of Veterans Affairs (VA), Gulf Coast Veterans Health Care System, Biloxi Veterans Affairs Medical Center (Biloxi VAMC) reported that the office of an employee was vandalized.  Paper files were found on the office floor, and the protected health information (PHI) of approximately 1,814 individuals was compromised.  The PHI included full names, social security numbers, dates of birth, and medical diagnoses.  The CE provided breach notification to HHS, the media and affected individuals.  Following the breach, VA police at the facility reviewed procedures and continued foot patrols to ensure office doors are locked during non-business hours.  The CE provided additional training to workforce members of the affected department on its physical security policies and procedures to improve safeguards for PHI.  OCR obtained assurances that the CE implemented the corrective action listed above.
Freda J Bowman  MD PA	TX	1300	9/20/2011	Unauthorized Access/Disclosure, Hacking/IT Incident	Network Server
Bonney Lake Medical Center and Mythili R. Ramachandran, MD	WA	2367	8/12/11	Theft	Laptop, Desktop Computer
United States Steel Corporation Plan for Active Employee Insurance Benefits and the United States Steel Corporation Plan for Retiree Insurance Benefits	PA	4000	8/15/2011	Loss	Other Portable Electronic Device, Other
VA Illiana Health Care System	IL	518	7/14/2011	Loss	Paper
Health Texas Provider Network	TX	1259	7/27/2011	Theft	Laptop
Blue Cross of Northeastern Pennsylvania	PA	507	9/9/11	Theft, Unauthorized Access/Disclosure	Laptop, Paper
NYU Hospital for Joint Diseases Inventory Management Department	NY	2600	6/23/2011	Theft	Paper	A box containing 2,600 paper records of tissue implants used in surgeries was discarded by a waste disposal contractor of the covered entity (CE), NYU Hospital for Joint Diseases Inventory Management Department, when the box was not property secured.  The box contained the protected health information (PHI) of 2,239 individuals and included names, dates of birth, dates of surgery, surgeon names, procedures, and types and serial numbers of the tissues used in the surgeries.  Upon discovery of the breach, the CE contacted the waste disposal contractor and determined that the documents were discarded and buried in a landfill out of state.  The CE provided breach notification to HHS, the media, and affected individuals, and posted substitute notice on its website.  As a result of OCR's investigation, the CE improved safeguards by storing all tissue records in a locked cabinet and requiring management to store the keys.  In addition, the CE counseled the employees involved in the incident and retrained all staff on its policies and procedures for safeguarding PHI.  The CE also implemented a plan to conduct reviews of HIPAA compliance, including both physical access and physical security risks.
WAYNE HIGHLANDS SCHOOL DISTRICT	PA	579	9/9/11	Theft, Unauthorized Access/Disclosure	Paper
Summit Medical Group, PLLC	TN	731	9/4/11	Theft	Paper
MAPFRE Life	PR	2209	8/5/11	Theft	Other
American Continental Insurance Company	TN	690	7/28/2011	Theft	Other Portable Electronic Device, Other
United of Omaha Life Insurance Company	NE	1631	7/28/2011	Loss	Other Portable Electronic Device, Other
Mutual of Omaha Insurance Company	NE	705	7/28/2011	Theft	Other Portable Electronic Device, Other
Henry Ford Health System	MI	520	8/8/11	Theft	Desktop Computer
Indiana University	IN	3266	8/16/2011	Theft	Laptop
Adult & Pediatric Dermatology, PC	MA	2200	9/14/2011	Theft	Other Portable Electronic Device, Other
The Nemours Foundation	FL	1055489	8/10/11	Loss	Other
California Industrial Medicine, Inc.	CA	700	9/28/2011	Theft, Unauthorized Access/Disclosure	Paper
InStep Foot Clinic, P.A.	MN	2600	8/28/2011	Theft	Laptop, Electronic Medical Record
North Memorial	MN	6697	7/25/2011	Theft	Laptop
Lahey Clinic Hospital, Inc.	MA	599	8/12/11	Theft	Laptop
UnitedHealth Group health plan single affiliated covered entity	MN	3994	7/28/2011	Theft	Other
Good Samaritan Hospital	MD	1500	9/9/11	Theft	Paper
Amerigroup Community Care of New Mexico, Inc	NM	1537	7/15/2011	Theft	Paper
Florida Hospital	FL	12784	8/10/11	Unauthorized Access/Disclosure	Electronic Medical Record
Thomas Jefferson University Hospitals, Inc.	PA	3150	9/6/11	Theft	Other
Lankenau Medical Center	PA	500	9/6/11	Theft	Other
Spectrum Health Ssytems, Inc.  	MA	14750	8/24/2011	Theft	Desktop Computer
Conway Regional Medical Center	AR	1472	8/24/2011	Loss	Other
Concordia Plan Services	MO	7059	5/10/11	Loss	Other
Stone Oak Urgent Care & Family Practice	TX	6672	10/23/2011	Theft, Loss	Desktop Computer
Indiana University School of Optometry	IN	757	8/12/11	Unauthorized Access/Disclosure	Network Server
Brevard Emergency Services, P.A.	FL	2200	8/26/2011	Theft	Paper
Georgetown University Hospital	DC	1526	9/9/11	Loss	Other Portable Electronic Device, Other
Morris Heights Health Center	NY	927	8/27/2011	Theft	Laptop	An unencrypted laptop computer containing the electronic protected health information (ePHI) of 927 individuals was stolen from the covered entity's (CE) school based health center.  The ePHI included names, dates of birth, sex, ethnicities, height, weight, body mass index data, complete physical examination information such as asthma and obesity information, health action plans, and enrollment dates.  Upon discovery of the breach, the CE filed a police report to recover the stolen laptop.  As a result of OCR's investigation, the CE purchased locks to physically secure its' school health computers to the desks where the computers are located.  In addition, the CE encrypted all portable devices' hard drives and installed software to track portable devices. The CE also retrained all staff on its policies and procedures for using and securing ePHI. 
network180	MI	1100	9/16/2011	Theft	Paper
Premier Imaging	NC	551	9/14/2011	Unknown	Paper	A newly hired employee impermissibly took patient registration documents home. The records taken included the protected health information of 551 patients.  The information at issue included names, addresses, birth dates, social security numbers, and driver's license numbers. As a result, the CE terminated the employee, provided notice to the affected individuals, amended registration procedures, implemented additional safeguards for such information, and offered identity theft protection to the affected individuals.
The Good Samaritan Hospital of Cincinnati, Ohio	OH	1089	9/3/11	Theft	Desktop Computer
Bethesda Hospital, Inc.	OH	946	9/3/11	Theft	Desktop Computer
Julie A. Kennedy, D.M.D., P.A.	FL	2900	9/30/2011	Theft	Network Server
KCI USA, Inc.	TX	567	9/8/11	Theft	Other Portable Electronic Device, Other
Lebanon Internal Medicine Associates	PA	55000	9/10/11	Improper Disposal	Network Server
St. Joseph Medical Center	MD	5000	9/11/11	Theft	Other, Paper
TRICARE Management Activity (TMA)	VA	4900000	9/13/2011	Loss	Other
UCLA Health System	CA	2761	9/6/11	Theft	Other Portable Electronic Device, Other
Logan County Emergeny Ambulance Service Authority	WV	12563	10/1/11	Theft, Loss	Laptop
Lawrence Memorial Hospital	KS	8275	09/20/2011 - 10/28/2011	Unauthorized Access/Disclosure, Other	Other
Sutter Medical Foundation	AL	943434	10/15/2011	Theft	Desktop Computer
Medcenter One	ND	650	10/21/2011	Theft	Laptop
Dallas County Hospital District dba Parkland Health & Hospital System	TX	2464	9/5/11	Unauthorized Access/Disclosure	Electronic Medical Record, Paper
University of Kentucky UK HealthCare	KY	878	9/25/2011	Loss	Other Portable Electronic Device
State of Tennessee Sponsored Group Health Plan	TN	1770	10/6/11	Unauthorized Access/Disclosure	Paper	An equipment operator at the state's postal facility set the machine to insert four (4) pages per envelope instead of one (1) page per envelope, which caused the PHI of four individuals to be sent to one address per envelope.  The error affected approximately 1770 enrollees. The letters contained information such as names, addresses, birth dates, and social security numbers. As a result, the CE retrained the employee, submitted a breach report to HHS, provided notice to the affected individuals, notified the media, created a toll-free number for information regarding the incident, posted notice on its website, modified policies to remove the SSN on templates for future mailings, and offered identity theft protection to the affected individuals. Following the OCR investigation, the CE provided reviewed its policies and procedures to ensure adequate safeguards are in place. 
Cleveland Clinic Florida	FL	772	10/3/11	Loss	Other
Jay C. Platt, DDS	IN	10705	10/6/11	Theft	Other
Rite Aid Corporation 	PA	2900	10/7/11	Other	Paper
Advanced Occupational Medicine Specialists	IL	7226	10/12/11	Unauthorized Access/Disclosure	Network Server
Open MRI of Chicago	IL	2000	9/6/11	Improper Disposal	Paper
University of Nebraska Medical Center	NE	611	11/15/2011	Theft	Paper
Roberts S. Smith M.D. Inc.	GA	17000	10/17/2011	Theft	Laptop
Paul C. Brown, MD, PS	WA	4693	10/14/2011 - 10/17/2011	Theft	Other
Molina Healthcare of California	CA	11081	9/23/2009	Other	Paper
Aegis Sciences Corporation	TN	2185	11/22/2011	Theft	Laptop, Other Portable Electronic Device	OCR opened an investigation of the covered entity (CE), Aegis Science Corp., after the CE reported that a laptop computer and unencrypted external hard drive containing the electronic protected health information (ePHI) of 2,185 individuals were stolen from a workforce member's vehicle.  The ePHI included social security numbers, driver's license numbers, and other demographic information, as well as bank account information of fourteen individuals and credit card information of three individuals.  Upon discovering the breach, the CE filed a police report and hired a private investigator to recover the stolen items.  The CE also initiated plans to encrypt laptops, revise security procedures, retrain employees, and offer credit monitoring to affected individuals.  As a result of OCR's investigation, the CE completed a security risk analysis and risk management report and implemented new security policies and procedures to ensure adequate safeguards to protect ePHI.  The CE also provided media notification in the two localities with greater than 500 individuals affected.  Additionally, the CE encrypted all employee computers and removable media containing ePHI and retrained employees on the CE's confidentiality and security policies.
Soundpath Health, Inc	WA	7581	11/22/2011	Theft	Laptop
Concentra Health	TX	870	11/30/2011	Theft	Laptop
Sleep HealthCenters LLC	MA	2988	11/23/2011	Theft	Laptop
Smile Designs	FL	1670	12/1/11	Theft	Desktop Computer, Network Server
