Name_of_Covered_Entity	State	Individuals_Affected	Date_of_Breach	Type_of_Breach	Location_of_Breached_Information	Summary
Montefiore Medical Center	NY	23753	6/9/10	Theft	Desktop Computer	OCR opened an investigation of the covered entity (CE), Montefiore Medical Center, after it reported three unencrypted desktop computers were stolen that contained the electronic protected health information (ePHI) of 23,753 individuals.  The ePHI included names, medical record numbers, dates of birth, parent or guardian contact numbers, asthma diagnoses, vaccination information, and number of visits to the school health clinic.  Upon discovery of the breach, the CE filed a police report and provided breach notification to affected individuals, HHS, and the media.  As a result of OCR's investigation, the CE updated its building alarm to include additional motion sensors and installed surveillance cameras.  Further, the CE encrypted all of its computers, advised that no ePHI is stored on desktop hard drives, removed all ePHI from its computers, and stored ePHI on the centralized secured network servers.  The CE also revised its policy and procedure on password management and provided training to all staff on its new policy.
Medina County OB/GYN	OH	1200	6/13/2010	Improper Disposal	Paper
The University of Texas at Arlington	TX	27000	2/19/2009	Hacking/IT Incident	Network Server	A file server at the Office of Health Services was compromised and impermissibly accessed.  The compromise potentially exposed the prescription records of 27,000 individuals to an unauthorized source.  The protected health information involved in the breach included names, addresses diagnostic codes, name of medication prescribed, medication costs and some social security numbers.  Following the discovery of the breach, UTA removed the server from the network, notified the affected individuals and notified local media.  Following the breach, the covered entity also replaced the operating system and implemented additional technical safeguards.  
Aetna	CT	6372	3/29/2010	Improper Disposal	Paper
Charles Mitchell MD	TX	6873	6/27/2010	Theft	Desktop Computer	A burglary occurred at the covered entity's (CE) facility and two desktop computers containing protected health information (PHI) were stolen.  Approximately 6873 individuals were affected.  The PHI involved included names, addresses, dates of birth, social security numbers, diagnoses and conditions, medications, and other treatment information.  OCR closed this investigation after determining that the individual who reported the breach worked for a CE no longer in existence.
Humana Inc case 4486	KY	2631	6/25/2010	Other	Paper
WellPoint, Inc.	IN	31700	11/3/09	Hacking/IT Incident	Network Server
Carolina Center for Development and Rehabilitation	NC	1590	6/24/2010	Theft	Paper	The covered entity's (CE) staff inadvertently sent twenty-three boxes containing the protected health information (PHI) of 1,590 patients to a recycling center.  The PHI included patients' full names, addresses, dates of birth, social security numbers, insurance identification numbers, driver's license numbers, diagnoses, medication information, checking and savings account numbers, credit and debit card numbers, and photographs of the patients.  Following the breach, the CE immediately took steps for the records to be returned.  The CE notified HHS, the media, and all individuals affected by the breach, and established a toll free number for patients to call for more information.  The CE cooperated with the state attorney general's investigation and suspended the responsible staff members.  Following OCR's investigation, the CE placed a record into its accounting of disclosure log for each individual affected and terminated the employment of the staff involved in the breach.  In addition, the CE revised its policies and procedures regarding the rights of individuals and safeguards for PHI, and re-trained staff.  
Trinity Health Corporation Welfare Benefit Plan	MI	1073	3/29/2010	Loss	Other
Texas Children's Hospital	TX	694	5/13/2010	Theft	Laptop
Baylor College of Medicine	TX	1646	5/13/2010	Theft	Laptop	An unencrypted laptop containing electronic protected health information (ePHI) of approximately 1,618 individuals was stolen from the covered entity's (CE) affiliate.  The ePHI involved in the breach included names, medical reconciliation numbers, dates of service, diagnoses, and dates of birth.  Upon discovery of the breach, the CE and its affiliate jointly notified the affected individuals, OCR, and the local media.  Notifications were delayed at the request of law enforcement.  Following OCR's investigation, the CE revised policies and procedures to require encryption of all mobile devices containing PHI and began encrypting all necessary devices in order to ensure reasonable safeguards.
Wright State Physicians	OH	1309	6/11/10	Other	Laptop	On June 11, 2010, a laptop computer containing PHI was mistakenly discarded in the trash. The laptop computer contained the protected health information of approximately 1,309 individuals. The protected health information involved in the breach included patient full names or first initial and last name, dates of service, and in some cases, a brief description of medical condition or care. Following the breach, the covered entity submitted evidence of its progress in implementing encryption on its laptop computers in its various departments.         
Penn Treaty Network America Insurance Company 	PA	560	6/4/10	Other	Other	Social security numbers were inadvertently printed on the address labels in a newsletter mailing.  The mailing had 560 recipients.  The covered entity acted to mitigate the disclosure by verifying that the all mail was correctly delivered.  It also counseled the responsible employee and updated its policies and procedures.
Aultman Hospital	OH	13867	6/7/10	Theft	Laptop
Fort Worth Allergy and Asthma Associates	TX	25000	6/29/2010	Theft	Network Server
Beauty Dental, Inc.	IL	657	6/5/10	Theft, Loss	Paper	Following the breach, the covered entity notified its clients by letter of the incident, submitted a press release that outlined the circumstances of the breach to the Chicago Tribune and the Chicago Sun Times, required the individual who allegedly stole the documents to return all physical patient PHI in her possession and sign a statement swearing that she no longer possessed any patient documents, would not use or disclose the PHI in any manner and would erase an excel spreadsheet she had in her possession, installed a new security system for the office that requires the input of a code specific to each employee, and implemented new technical safeguards that limited employee access to ePHI according to the employee's position and rank.
Walsh Pharmacy	MA	11440	6/3/10	Other	Other Portable Electronic Device, Other
Jewish Hospital	KY	2089	7/16/2010	Theft	Laptop
St. John's Mercy Medical Group	MO	1907	6/7/10	Improper Disposal	Paper	Covered entity improperly disposed of patients' Protected Health Information (PHI), by placing the PHI in a dumpster outside of a doctor's office. The PHI involved in the breach included demographic, financial, clinical, and other medical information. Following the breach, the covered entity notified all affected individuals of the breach, posted a notice about the incident on its website; attempted to retrieve and track all of the medical records that were inappropriately disposed of; offered all affected individuals identity theft protection; obtained a formal apology from and assumed direct office operations management of the physician involved; re-educated its workforce to reinforce policies relating to appropriate medical record protection and disposal requirements.
Thomas Jefferson University Hospitals, Inc.	PA	21000	6/14/2010	Theft	Laptop
UNCG Speech and Hearing Center	NC	2300	1/1/97	Hacking/IT Incident	Desktop Computer
Idaho Power Group Health Plan	ID	5500	3/29/2010	Loss	Other	Idaho Power Group Health Plan's business associate, Mercer Health and Benefits, lost a backup tape as it was being sent via FEDEX from Boise to Seattle. The backup tape contained information of about 375,000 individuals that Mercer serviced. The total affected at Idaho Power was about 5,500 current and former employees and their dependents. The protected health information involved included names, addresses, dates of birth, and social security numbers. Although Mercer concluded that the lost tape was configured so that even a sophisticated user would be unlikely to be able to access the data within, both Mercer and Idaho Power notified all possible affected individuals and offered free credit protection services. To prevent a similar breach from occurring in the future, Mercer now stores backup tapes through a third party vendor who offers secure transport services. Mercer's Boise office now encrypts backup tapes. Following the incident, Idaho Power renegotiated its contract with Mercer and continues to evaluate its business relationship with Mercer.
Loma Linda University School of Dentistry	CA	10100	6/13/2010	Theft	Desktop Computer
Ward A. Morris, DDS	WA	2698	7/16/2010	Theft	Desktop Computer
Chattanooga Family Practice Associates, P.C.	TN	1711	7/15/2010	Loss	Other Portable Electronic Device, Other
Yale University	CT	1000	7/28/2010	Theft	Laptop
University of Kentucky	KY	2027	6/18/2010	Theft	Laptop
Cook County Health & Hospitals System	IL	7081	5/30/2010	Theft	Laptop	An employee's laptop was stolen out of a locked office; evidence shows that the laptop was password protected but not encrypted.  The laptop contained the protected health information (PHI) of approximately 7,000 individuals.  The PHI stored on the laptop included names, dates of birth, Social Security numbers, internal encounter numbers, and other administrative codes.  Following the breach, the covered entity notified those individuals reasonably believed to have been affected by the breach, placed notice on its website and with a local news center; established stringent computer security guidelines, and retrained its staff in the new requirements with the intention of preventing a similar event from occurring again.
Eastmoreland Surgical Clinic, William Graham, DO	OR	4328	7/5/10	Theft	Laptop, Desktop Computer, Other Portable Electronic Device, Other	Three desktop computers, one laptop computer, and a backup drive, containing the electronic protected health information (EPHI) of 4,328 individuals, were stolen on July 5, 2010.  The EPHI involved in the breach included names, addresses, phone numbers, dates of birth, Social Security numbers, reason for visits, and insurance information.  Following the breach, the covered entity implemented backup and whole disk encryption on electronic information systems that maintain EPHI and improved their physical safeguards.  Additionally, OCR's investigation resulted in the covered entity improving their administrative safeguards, such as password complexity requirements and data backup protocols.
SunBridge Healthcare Corporation	NM	1000	6/26/2010	Theft	Other Portable Electronic Device, Other
Holyoke Medical Center	MA	24750	7/26/2010	Improper Disposal	Paper
Newark Beth Israel Medical Center	NJ	956	5/10/10	Theft	Other Portable Electronic Device, Other	OCR opened an investigation of the covered entity (CE), Newark Beth Israel Medical Center, after it reported an employee of the CE's business associate (BA), KPMG LLP, lost an unencrypted USB drive that contained the electronic protected health information (ePHI) of 956 individuals.  The ePHI included names and clinical information.  Upon discovery of the breach, the CE's BA conducted a search of the area.  The CE provided breach notification to HHS, the Media and affected individuals.  As a result of OCR's investigation, the BA installed and implemented encryption software to its electronic equipment and devices.  In addition, the BA encrypted and password protected all equipment and devices that could contain the CE's data.  The BA also reprimanded and retrained the employee and retrained all employees on safeguarding ePHI.  The breach incident involved a BA and occurred prior to the September 23, 2013, compliance date.  OCR verified that the CE had a proper BA agreement in place that restricted the BA's use and disclosure of PHI and required the BA to safeguard all PHI.
Saint Barnabas Medical Center	NJ	3630	5/10/10	Theft	Other Portable Electronic Device	The covered entity (CE), Long Island Consultation Center, misplaced an unencrypted portable device that contained the electronic protected health information (ePHI) of 800 individuals.  The ePHI included names, dates of birth, diagnoses, and other treatment information.  Upon discovery of the breach, the CE conducted a search for the portable device.  The CE provided breach notification to HHS, the media, and affected individuals.  As a result of OCR's investigation, the CE improved physical security.   The CE also developed and implemented a policy and procedure prohibiting use of portable media for storing ePHI and trained staff on its new policy. 
NYU School of Medicine--Aging and Dementia Clinical Research Center 	NY	1200	4/3/10	Loss	Other Portable Electronic Device, Other
University of Rochester Medical Center and Affiliates	NY	857	8/2/10	Loss	Other Portable Electronic Device
State of Delaware Health Plan	DE	22642	8/16/2010	Other	Network Server	The business associate prepared a document as part of a request for proposal for the covered entity's vision benefit program which mistakenly included protected health information of 22,642 individuals.  The document was posted online for five days.  The protected health information involved in the breach included social security numbers, dates of birth, gender, zip codes, and vision plan enrollment information.  In response to this incident, the covered entity implemented additional safeguards to prevent this type of impermissible disclosure of protected health information.  In particular, the covered entity will now require several layers of review before allowing public disclosure of documents prepared by the business associate.  The covered entity also took steps to enforce the requirements of its business associate agreement with Aon Consulting.  Aon will provide affected individuals with free credit monitoring, fraud resolution resources, and identity theft insurance.  Additionally, the business associate has provided assurances to the covered entity that it has taken steps to prevent this type of impermissible disclosure in the future.
Curtis R. Bryan, M.D.	VA	2739	7/12/10	Theft	Laptop
Mayo Clinic	MN	1740	7/15/2009	Unauthorized Access/Disclosure	Electronic Medical Record
LabCorp Patient Service Center	NV	507	8/2/10	Theft	Paper
The Kent Center 	RI	1361	7/13/2010	Theft	Paper
Pediatric and Adult Allergy, PC	IA	19222	7/11/10	Loss	Other Portable Electronic Device
Ault Chiropractic Center	IN	2000	9/15/2010	Theft	Laptop, Desktop Computer
County of Los Angeles	CA	33000	7/29/2010	Theft	Paper
Matthew H. Conrad, M.D., P.A.	KS	1200	8/20/2010	Theft	Laptop, Paper
UnitedHealth Group health plan single affiliated covered entity	MN	1270	7/8/10	Other	Paper
Counseling and Psychotherapy of Throggs Neck	NY	9000	9/6/10	Theft	Desktop Computer
United States Air Force	OH	2123	7/29/2010	Improper Disposal	Paper
State of Alaska, Department of Health and Social Services	AK	2000	9/7/10	Theft	Other Portable Electronic Device, Other
St. Vincent Hospital and Health Care Center, Inc.	IN	1199	7/25/2010	Theft	Laptop
Milford Regional Medical Center	MA	20000	7/26/2010	Improper Disposal	Paper
Alliance HealthCare Services, Inc.	CA	1474	7/31/2010	Theft	Other Portable Electronic Device, Other	The covered entity (CE) filed a breach report with OCR after two USB storage devices containing electronic protected health information (ePHI) of 1,474 individuals were lost.  The ePHI included names, dates of birth, and treatment information.  Upon discovery of the breach, the CE notified individuals, OCR and the media.  Additionally, the CE initiated an encryption project to encrypt emails, external hard drives, and related media.  Following OCR's investigation, the CE filed a police report, updated its policies and procedures in an effort to better safeguard ePHI, and encrypted USB devices.
Alliance HealthCare Services, Inc.	CA	1474	8/5/10	Theft	Other Portable Electronic Device, Other	The covered entity (CE) lost two portable electronic storage devices containing the electronic protected health information (ePHI) of 1,474 individuals.  The ePHI included patients' names, dates of birth, and treatment information.  Upon discovery of the breach, the covered entity (CE) notified individuals, HHS, and the media.  Additionally, the CE initiated a project to encrypt emails, external hard drives, and related electronic media.  Following OCR's investigation, the CE filed a police report, updated its policies and procedures in order to better safeguard patients' ePHI, and encrypted portable electronic computer devices.
NewYork-Presbyterian Hospital and Columbia University Medical Center	NY	6800	7/1/10	Theft	Network Server	Data breach results in $4.8 million HIPAA settlements
St. James Hospital and Health Centers	IL	967	8/10/10	Improper Disposal	Paper
University of Oklahoma - Tulsa, Neurology Clinic	OK	19200	7/28/2010	Hacking/IT Incident	Desktop Computer
LORENZO BROWN, MD INC.	CA	928	8/17/2010	Theft	Desktop Computer
Milton Pathology Associates, P.C.	MA	11000	7/26/2010	Improper Disposal	Paper
WESTMED Medical Group	NY	578	8/17/2010	Theft	Laptop	An unencrypted laptop computer that contained the electronic protected health information (ePHI) of 578 individuals was stolen from the covered entity (CE), WestMed Medical Group.  The ePHI included names, dates of birth and test results.  Upon discovery of the breach, the CE filed a police report and provided breach notification to affected individuals, HHS and the media.  As a result of OCR's investigation, the CE improved physical security by locking all laptops during the day and storing all laptops in a locked cabinet overnight.  In addition, the CE reconfigured all laptops with strong passwords and implemented a new procedure to save data to a secure file server.  Further, the CE encrypted all laptop hard drives.  The CE also retrained staff on safeguarding ePHI.
Debra C. Duffy, DDS	TX	4700	8/5/10	Theft	Laptop, Network Server	An unencrypted laptop and network server were stolen during a burglary of the office.The breach affected approximately 4700 individuals.The protected health information involved in the breach included treatment information for pediatric dental patients and social security numbers, insurance identification numbers and driver's license numbers. Following the discovery of the breach, the CE relocated the practice servers, secured the laptops and installed steel doors at the front entrance of the facility. Additionally, the CE notified the affected individuals and local media and retrained staff.  
Cumberland Gastroenterology, P.S.C.	KY	2200	9/18/2010	Theft	Paper
Johns Hopkins University Applied Physics Laboratory (JHU/APL) Medical and Dental Insurance Plan	MD	692	6/15/2010	Other	Other	Protected health information was attached to an email addressed to 85 employees by a benefits staff member. Within 5 days, all recipients were notified, and the email was deleted.  Approximately 692 individuals were affected by this breach.  The email included names, dates of birth, social security numbers, and marital and disability status.  To prevent a similar breach from happening in the future, the covered entity instituted a policy to encrypt emails containing protected health information before it is sent out from the benefits department.  Following OCR's investigation, the covered entity updated its policies and procedures establishing a new business process to require that all emails sent by the benefits office to 5 or more staff members that includes an attachment be reviewed by another team member to ensure the proper document is attached and took personnel action with the responsible employee. Further, the benefits office will use an encryption specialist to train all benefits office staff in the proper methods of encryption, explore future capability of automated flagging of any electronic communications sent by benefits office staff containing potentially sensitive data such as 9-digit numbers, and obtain additional HIPAA training.
LoneStar Audiology Group	TX	585	8/11/10	Theft	Laptop	A laptop was stolen from a workforce member's home. Approximately 585 individuals were affected.  The PHI included addresses, dates of birth, diagnosis and conditions, medications and other treatment information. Following the breach, the covered entity encrypted all its laptops. After the initiation of OCR's investigation, the encryption of the laptops was completed.
Utah Department of Health	UT	1298	3/1/10	Other	Desktop Computer, Paper
SW Seattle Orthopaedic and Sports Medicine	WA	9493	9/4/10	Hacking/IT Incident	Network Server	A database web server, containing the electronic protected health information (EPHI) of 9,493 individuals, was breached by an unknown, external person(s) for use as a game server.  Although there was no indication of access to EPHI, the EPHI on the database web server included names, dates of birth, types of x-rays, and dates of x-rays.  Following the breach, the covered entity relocated two servers to its more secure primary data center and removed the Internet access line that resulted in the breach.  Additionally, OCR's investigation resulted in the covered entity improving their administrative safeguards, such as incident response and reporting.  
University of Arkansas for Medical Sciences	AR	1000	10/12/10	Theft	Other Portable Electronic Device, Other
BlueCross BlueShield of Tennessee, Inc.	TN	1023209	10/2/09	Theft	Other
Northridge Hospital Medical Center	CA	716	10/16/2010	Loss	Paper
Puerto Rico Department of Health	PR	475000	10/3/08	Unauthorized Access/Disclosure, Hacking/IT Incident	Network Server
Aetna, Inc.	CT	2345	9/9/10	Unauthorized Access/Disclosure	Network Server	Aetna notified all possibly affected individuals of the breach, filed a breach report with OCR, commenced an investigation to identify and correct the root cause of the issue; the coding changes that were causing the breach were removed from IPS via Aetna's emergency Change Management procedures to prevent any further exposure while the problem was analyzed; once the specific code that conflicted with its proxy server settings was identified as the root cause of the breach, it was removed. Also, in an effort to mitigate any harm as a result of the breach, Aetna offered all affected individuals one year of free credit monitoring, and the notification letters included a toll-free number which was established specifically to answer questions related to this incident. 
Sta-home Health & Hospice	MS	1104	9/16/2010	Theft	Desktop Computer
Puerto Rico Department of Health	PR	115000	9/3/10	Unauthorized Access/Disclosure	Other Portable Electronic Device, Other
VNA of Southeastern Ct.	CT	12000	9/30/2010	Theft	Laptop
Prime Home Care, LLC	NE	1550	9/13/2010	Theft	Desktop Computer
Visiting Nurse Service Association of Schenectady County	NY	535	9/14/2010	Theft	Laptop	An encrypted laptop computer that contained the electronic protected health information (ePHI) of 535 individuals was stolen from the covered entity (CE).  The ePHI included names, addresses, and dates of birth.  Upon discovery of the breach, the CE filed a police report to recover the stolen item.  Following OCR's investigation, the CE disabled the involved staff member's account, verbally counseled the staff member, and retrained the staff member.  The CE also adopted and implemented security policies and procedures for laptops/tablet devices and provided training to all staff.
Manor Care Indy (South), LLC.	IN	845	9/11/10	Unauthorized Access/Disclosure	Paper
Robert Wheatley, DDS, PC	MO	1400	10/17/2010	Theft	Laptop
Henry Ford Hospital	MI	3700	9/24/2010	Theft	Laptop
Holy Cross Hospital	FL	1500	7/27/2010	Theft	Paper
Newark Beth Israel Medical Center	NJ	1744	1/1/10	Theft	Network Server	The covered entity's (CE) business associate (BA), Professional Transcription Company, posted the electronic protected health information (ePHI) of 1,744 individuals on a website portal of the BA.  The ePHI included names, dates of birth, diagnosis, and other clinical information.  Upon discovery of the breach, the BA shut down the applicable server.  The CE, Newark Beth Israel Medical Center, provided breach notification to HHS, the media, and affected individuals and also posted substitute notice on its website.  As a result of OCR's investigation, the BA located the ePHI online and contacted Google to block files that contained ePHI.  In addition, the BA retrained all employees regarding its security policies.  The CE terminated its BA agreement with the BA.  The breach incident involved a BA and occurred prior to the September 23, 2013, compliance date.  OCR verified that the CE had a proper BA agreement in place that restricted the BA's use and disclosure of PHI and required the BA to safeguard all PHI.
Memorial Hospital of Gardena	CA	771	10/14/2010	Unauthorized Access/Disclosure	Paper
Oklahoma City VA Medical Center	OK	1950	10/8/10	Theft, Loss, Improper Disposal	Paper
Albert Einstein Healthcare Network	PA	613	10/21/2010	Theft	Desktop Computer
